{
  "$schema": "./store-identity.schema.json",
  "schemaVersion": 1,
  "applicationId": "cash.free2z.free2z",
  "apple": {
    "teamId": "F9AV5HKF6N",
    "distributionIdentity": "Apple Distribution: Corpora Inc (F9AV5HKF6N)",
    "appStoreConnectRecord": "created",
    "provisioningProfileName": "free2z appstore ci",
    "provisioningProfileUuid": "6d460b52-7806-4291-96d0-3990c76ccb6a"
  },
  "google": {
    "playConsoleListing": "missing",
    "uploadCertificateSha256": null,
    "appSigningCertificateSha256": "75:8D:0C:62:A4:9B:D2:C1:03:B5:C5:39:B5:AF:5C:55:C5:AC:5E:1A:35:EF:B7:22:95:B0:44:AD:50:4B:72:5A"
  }
}
